<?xml version="1.0" encoding="UTF-8"?>
<xs:schema xmlns:xs="http://www.w3.org/2001/XMLSchema">
	<xs:element name="list">
		<xs:complexType>
			<xs:sequence>
				<xs:element name="building" minOccurs="1" maxOccurs="unbounded">
					<xs:complexType>
						<xs:sequence>
							<xs:choice maxOccurs="unbounded" minOccurs="1">
								<xs:element name="modules" minOccurs="0" maxOccurs="1">
									<xs:complexType>
										<xs:sequence>
											<xs:element name="module" minOccurs="1" maxOccurs="unbounded">
												<xs:complexType>
													<xs:attribute name="id" type="xs:string" use="required" />
												</xs:complexType>
											</xs:element>
										</xs:sequence>
									</xs:complexType>
								</xs:element>
								<xs:element name="buildTime" minOccurs="1" maxOccurs="1">
									<xs:complexType>
										<xs:sequence>
											<xs:element name="set" minOccurs="1" maxOccurs="unbounded">
												<xs:complexType>
													<xs:attribute name="fromLevel" type="xs:positiveInteger" use="required" />
													<xs:attribute name="toLevel" type="xs:positiveInteger" use="optional" />
													<xs:attribute name="function" type="xs:string" use="required" />
												</xs:complexType>
											</xs:element>
										</xs:sequence>
									</xs:complexType>
								</xs:element>
								<xs:element name="stats" maxOccurs="1">
									<xs:complexType>
										<xs:sequence>
											<xs:element name="stat" minOccurs="1" maxOccurs="unbounded">
												<xs:complexType>
													<xs:attribute name="name" use="required">
														<xs:simpleType>
															<xs:restriction base="xs:string">
																<xs:enumeration value="ENERGY" />
																<xs:enumeration value="BASE_MAX_HEALTH" />
																<xs:enumeration value="BASE_MAX_SHIELD" />
																<xs:enumeration value="BASE_MAX_STORAGE_VOLUME" />
																<xs:enumeration value="BUILD_COOLDOWN_REDUCTION" />
																<xs:enumeration value="RESOURCE_PRODUCTION_SPEED" />
																<xs:enumeration value="RESOURCE_FEO" />
																<xs:enumeration value="RESOURCE_C" />
																<xs:enumeration value="RESOURCE_CH4" />
																<xs:enumeration value="RESOURCE_ATO3" />
																<xs:enumeration value="RESOURCE_H2O" />
																<xs:enumeration value="MAX_RESOURCE_FEO" />
																<xs:enumeration value="MAX_RESOURCE_C" />
																<xs:enumeration value="MAX_RESOURCE_CH4" />
																<xs:enumeration value="MAX_RESOURCE_ATO3" />
																<xs:enumeration value="MAX_RESOURCE_H2O" />
															</xs:restriction>
														</xs:simpleType>
													</xs:attribute>
													<xs:attribute name="function" type="xs:string" use="required" />
													<xs:attribute name="op" use="required">
														<xs:simpleType>
															<xs:restriction base="xs:string">
																<xs:enumeration value="DIFF" />
																<xs:enumeration value="PER" />
															</xs:restriction>
														</xs:simpleType>
													</xs:attribute>
												</xs:complexType>
											</xs:element>
										</xs:sequence>
									</xs:complexType>
								</xs:element>
								<xs:element name="energy" minOccurs="1" maxOccurs="1">
									<xs:complexType>
										<xs:sequence>
											<xs:element name="set" minOccurs="1" maxOccurs="unbounded">
												<xs:complexType>
													<xs:attribute name="fromLevel" type="xs:positiveInteger" use="required" />
													<xs:attribute name="toLevel" type="xs:positiveInteger" use="optional" />
													<xs:attribute name="function" type="xs:string" use="required" />
												</xs:complexType>
											</xs:element>
										</xs:sequence>
									</xs:complexType>
								</xs:element>
								<xs:element name="requirements" minOccurs="0" maxOccurs="1">
									<xs:complexType>
										<xs:sequence>
											<xs:choice maxOccurs="unbounded" minOccurs="1">
												<xs:element name="functions" minOccurs="0" maxOccurs="unbounded">
													<xs:complexType>
														<xs:sequence>
															<xs:choice minOccurs="1" maxOccurs="unbounded">
																<xs:element name="function" minOccurs="1" maxOccurs="unbounded">
																	<xs:complexType>
																		<xs:attribute name="fromLevel" type="xs:positiveInteger" use="required" />
																		<xs:attribute name="toLevel" type="xs:positiveInteger" use="optional" />
																		<xs:attribute name="itemId" type="xs:string" use="required" />
																		<xs:attribute name="value" type="xs:string" use="required" />
																	</xs:complexType>
																</xs:element>
															</xs:choice>
														</xs:sequence>
													</xs:complexType>
												</xs:element>
												<xs:element name="requirement" minOccurs="0" maxOccurs="unbounded">
													<xs:complexType>
														<xs:sequence>
															<xs:choice maxOccurs="unbounded" minOccurs="1">
																<xs:element name="item" minOccurs="0" maxOccurs="unbounded">
																	<xs:complexType>
																		<xs:attribute name="id" type="xs:string" use="required" />
																		<xs:attribute name="count" type="xs:integer" use="required" />
																	</xs:complexType>
																</xs:element>
																<xs:element name="building" minOccurs="0" maxOccurs="unbounded">
																	<xs:complexType>
																		<xs:attribute name="id" type="xs:string" use="required" />
																		<xs:attribute name="level" type="xs:integer" use="required" />
																	</xs:complexType>
																</xs:element>
																<xs:element name="technology" minOccurs="0" maxOccurs="unbounded">
																	<xs:complexType>
																		<xs:attribute name="id" type="xs:string" use="required" />
																		<xs:attribute name="level" type="xs:integer" use="required" />
																	</xs:complexType>
																</xs:element>
															</xs:choice>
														</xs:sequence>
														<xs:attribute name="level" type="xs:integer" use="required" />
													</xs:complexType>
												</xs:element>
											</xs:choice>
										</xs:sequence>
									</xs:complexType>
								</xs:element>
								<xs:element name="properties" minOccurs="0" maxOccurs="1">
									<xs:complexType>
										<xs:sequence>
											<xs:choice maxOccurs="unbounded" minOccurs="1">
												<xs:element name="property" minOccurs="1" maxOccurs="unbounded">
													<xs:complexType>
														<xs:attribute name="name" type="xs:string" use="required" />
														<xs:attribute name="type" type="xs:string" use="optional" />
														<xs:attribute name="value" type="xs:string" use="required" />
													</xs:complexType>
												</xs:element>
											</xs:choice>
										</xs:sequence>
									</xs:complexType>
								</xs:element>
								<xs:element name="propertiesByLevel" minOccurs="0" maxOccurs="1">
									<xs:complexType>
										<xs:sequence>
											<xs:choice maxOccurs="unbounded" minOccurs="1">
												<xs:element name="property" minOccurs="1" maxOccurs="unbounded">
													<xs:complexType>
														<xs:attribute name="name" type="xs:string" use="required" />
														<xs:attribute name="value" type="xs:string" use="required" />
													</xs:complexType>
												</xs:element>
												<xs:element name="properties" minOccurs="0" maxOccurs="1">
													<xs:complexType>
														<xs:sequence>
															<xs:element name="list" minOccurs="1" maxOccurs="unbounded">
																<xs:complexType>
																	<xs:sequence>
																		<xs:element name="set" minOccurs="1" maxOccurs="unbounded">
																			<xs:complexType>
																				<xs:attribute name="name" type="xs:string" use="required" />
																				<xs:attribute name="value" type="xs:string" use="required" />
																			</xs:complexType>
																		</xs:element>
																	</xs:sequence>
																	<xs:attribute name="name" type="xs:string" use="required" />
																</xs:complexType>
															</xs:element>
														</xs:sequence>
														<xs:attribute name="level" type="xs:integer" use="required" />
													</xs:complexType>
												</xs:element>
											</xs:choice>
										</xs:sequence>
									</xs:complexType>
								</xs:element>
							</xs:choice>
						</xs:sequence>
                        <xs:attribute name="id" type="xs:normalizedString" use="required" />
                        <xs:attribute name="nameId" type="xs:normalizedString" use="required" />
						<xs:attribute name="class" type="xs:string" use="required" />
                        <xs:attribute name="descriptionId" type="xs:normalizedString" use="required" />
                        <xs:attribute name="maxLevel" type="xs:positiveInteger" use="required"/>
						<xs:attribute name="maxBuild" type="xs:positiveInteger" use="optional" />
					</xs:complexType>
				</xs:element>
			</xs:sequence>
			<xs:attribute name="disabled" type="xs:boolean" use="optional" />
		</xs:complexType>
	</xs:element>
</xs:schema>