<?xml version="1.0" encoding="UTF-8"?>
<list xmlns:xsi="http://www.w3.org/2001/XMLSchema-instance" xsi:noNamespaceSchemaLocation="../../xsd/buildings.xsd">
    <building id="10000" type="HEADQUARTER" name="Headquarter" maxHealth="10000" maxLevel="50" buildTime="60" description="The Headquarter is the main building that allow you to manage your base.">
        <creation>
            <item id="100" count="1" />
            <item id="101" count="1" />
            <item id="102" count="1" />
        </creation>
    </building>
    <building id="10001" type="STORAGE" name="Storage" maxHealth="10000" maxLevel="50" buildTime="60" description="The Storage building is a important building to increase your storage capacity.">
        <creation>
            <item id="100" count="10" />
            <item id="101" count="10" />
            <item id="102" count="10" />
            <building type="HEADQUARTER" level="1" />
            <!--<technology id="" level="" />-->
        </creation>
    </building>
</list>