<?xml version="1.0" encoding="UTF-8"?>
<list xmlns:xsi="http://www.w3.org/2001/XMLSchema-instance" xsi:noNamespaceSchemaLocation="../../xsd/buildings.xsd">
    <building id="embassy" nameId="building_embassy_n" type="CommonBuilding" descriptionId="building_embassy_d" maxLevel="5" buildTimeFunc="10*$level">
        <requirements>
            <requirement level="1">
                <item id="resource_feo" count="2000" />
                <item id="resource_h2o" count="300" />
                <item id="resource_ato3" count="50" />
            </requirement>
            <requirement level="2">
                <item id="resource_feo" count="3000" />
                <item id="resource_h2o" count="400" />
            </requirement>
            <requirement level="3">
                <item id="resource_feo" count="5000" />
                <item id="resource_h2o" count="600" />
            </requirement>
            <requirement level="4">
                <item id="resource_feo" count="10000" />
                <item id="resource_h2o" count="2500" />
            </requirement>
            <requirement level="5">
                <item id="resource_feo" count="20000" />
                <item id="resource_h2o" count="7500" />
            </requirement>
        </requirements>
    </building>
</list>